PW001,Traditional Wedding Package,1850000,Khai vi: Goi cuon tom thit;Mon chinh: Ca chien xu;Canh chua ca loc;Com trang;Trang mieng: Che hat sen
PW002,Company Year End Party,2085000,Khai vi: Sup ga ngo;Nom bo rau mam;Mon chinh: Tom hap bia;Bo sot tieu den;Trang mieng: Rau cau dua
PW003,Family Celebration,1950000,Khai vi: Salad tron;Mon chinh: Ga hap xa;Ca kho to;Canh bi dao thit bam;Com trang;Trang mieng: Che thai
PW004,Birthday Special,1750000,Khai vi: Cha gio;Mon chinh: Bo luc lac;Ca chien sot ca;Canh cai thit;Com trang;Trang mieng: Trai cay
PW005,Anniversary Deluxe,2250000,Khai vi: Goi ngo sen tom thit;Mon chinh: Ca hoi nuong;Bo ham tieu xanh;Canh mang cua;Com trang;Trang mieng: Che buoi
PW006,Traditional Ceremony,1950000,Khai vi: Nem ran;Mon chinh: Ga quay;Ca chim chien xu;Canh nam;Com trang;Trang mieng: Che hat sen 